<?xml version="1.0"?>
<settings xmlns="urn:settings" xmlns:xs="http://www.w3.org/2001/XMLSchema-instance" xs:schemaLocation="urn:settings Settings.xsd">
  <list orderAsc="Sort">
    <!--selectRowProperty="IsDefault"-->
    <global>
      <create/>
    </global>

    <actions>
      <visibility/>
      <sort field="Sort"/>
      <edit/>
      <delete/>
    </actions>

    <cols>
      <string name="Name" title="Название"/>
      <string name="Alias" title="Псевдоним" />
    </cols>

  </list>

  <form>
    <tab name="General">
      <string name="Name" title="Название" />
      <wysiwyg name="Description" title="Описание" />
    </tab>
    <tab name="Projects">
      <select name="Projects" reference="Projects" multiple="true" title="Проект">
        <option>Нет</option>
      </select>
    </tab>
    
    <tab name="Metadata">
      <string name="Alias" title="Псевдоним" info="Используется для генерации url" />
      <string name="MetaTitle" title="MetaTitle" />
      <string name="MetaKeywords" title="MetaKeywords" />
      <textarea name="MetaDescription" title="MetaDescription" />
    </tab>
  </form>
</settings>